{
  "report_id": "cln_jdh_3c",
  "outcome": "passed",
  "reasons": [],
  "blurred_key": "media/cleanups/cln_jdh_3c.jpg",
  "blur": { "faces": 0, "plates": 0, "provider": "rekognition", "model": "DetectFaces+DetectText", "version": "3.0" },
  "image_moderation": { "result": "pass", "labels": [], "provider": "rekognition", "model": "DetectModerationLabels+DetectLabels", "version": "7.0+3.0" },
  "checks": {
    "inside_india": { "result": "pass", "detail": "point inside the India boundary" },
    "fresh_timestamp": { "result": "pass", "detail": "captured 70 s before upload; limit 72 h" },
    "duplicate": { "result": "pass", "detail": "nearest earlier photo at pHash distance 30; limit 8" },
    "rate_limit": { "result": "pass", "detail": "1 photo in the last hour; limit 20" },
    "device_token": { "result": "pass", "detail": "known device, reputation 0.66" },
    "near_site": { "result": "pass", "detail": "after-photo 12 m from the site; limit 50 m" }
  },
  "phash": "5e2a90c7b1d43f68",
  "duplicate_of": null,
  "note_moderation": null,
  "moderated_at": "2026-10-09T06:21:10Z"
}
